{
  "scan_id": "20250907-184500_network_discovery_192.168.1.0_24",
  "module": "network_discovery",
  "target": "192.168.1.0/24",
  "scan_type": "comprehensive",
  "status": "completed",
  "start_time": "2025-09-07T18:45:00.123456Z",
  "end_time": "2025-09-07T18:45:15.789012Z",
  "duration": 15.665556,
  "results": {
    "network_range": "192.168.1.0/24",
    "total_hosts": 256,
    "hosts_scanned": 256,
    "hosts_alive": 12,
    "discovery_methods": [
      {
        "method": "fping",
        "hosts_found": 10,
        "duration": 2.1,
        "success": true
      },
      {
        "method": "arp_scan", 
        "hosts_found": 11,
        "duration": 3.2,
        "success": true
      },
      {
        "method": "nmap_discovery",
        "hosts_found": 12,
        "duration": 10.3,
        "success": true
      }
    ],
    "discovered_hosts": [
      {
        "ip_address": "192.168.1.1",
        "hostname": "router.local",
        "mac_address": "aa:bb:cc:dd:ee:ff",
        "vendor": "Cisco Systems",
        "response_time": 1.2,
        "discovery_method": ["fping", "arp_scan", "nmap_discovery"],
        "open_ports": [22, 80, 443]
      },
      {
        "ip_address": "192.168.1.10",
        "hostname": "server.local",
        "mac_address": "11:22:33:44:55:66",
        "vendor": "Dell Inc.",
        "response_time": 0.8,
        "discovery_method": ["fping", "arp_scan", "nmap_discovery"],
        "open_ports": [22, 80, 443, 3306]
      },
      {
        "ip_address": "192.168.1.20",
        "hostname": null,
        "mac_address": "77:88:99:aa:bb:cc",
        "vendor": "Apple, Inc.",
        "response_time": 2.1,
        "discovery_method": ["arp_scan", "nmap_discovery"],
        "open_ports": [22]
      }
    ],
    "network_info": {
      "gateway": "192.168.1.1",
      "broadcast": "192.168.1.255",
      "netmask": "255.255.255.0",
      "cidr": 24
    },
    "performance_stats": {
      "packets_sent": 768,
      "packets_received": 36,
      "packet_loss_rate": 0.953,
      "average_response_time": 1.37
    }
  },
  "metadata": {
    "version": "0.0.1",
    "scan_options": {
      "threads": 50,
      "timeout": 30,
      "methods": ["fping", "arp_scan", "nmap_discovery"],
      "safe_mode": true
    },
    "environment": {
      "python_version": "3.10.6",
      "platform": "Linux-5.15.0-58-generic-x86_64",
      "hostname": "security-lab"
    },
    "tools_used": [
      {"name": "fping", "version": "5.0", "path": "/usr/bin/fping"},
      {"name": "arp-scan", "version": "1.9.7", "path": "/usr/bin/arp-scan"},
      {"name": "nmap", "version": "7.80", "path": "/usr/bin/nmap"}
    ]
  },
  "warnings": [
    "Some hosts may be behind firewalls and not respond to ICMP",
    "ARP scan limited to local network segment"
  ]
}
